{
  "schemaVersion": 1,
  "fork": "alchemy",
  "source": {
    "displayName": "Alchemy",
    "path": "/viewer/alchemy",
    "commit": "0123456789abcdef0123456789abcdef01234567",
    "overridden": false,
    "adapter": "adapters/alchemy",
    "resourceRoot": "indra/newview"
  },
  "runtime": {
    "path": "/build/xui-lab",
    "fork": "alchemy",
    "commit": "0123456789abcdef0123456789abcdef01234567",
    "matched": true
  },
  "subjects": [
    {
      "name": "test_widgets",
      "requiredCapabilities": ["input", "inspection"],
      "openable": true,
      "unavailableReason": null
    }
  ]
}
